citation_url,citation,citation_id,source_export_id,export_label
https://www.earthchem.org/petdb/citation/01259a0cb2431834302abe2df60a1327,"Martyn, J. (1969). THE GEOLOGICAL HISTORY OF THE COUNTRY BETWEEN LAKE BARINGO AND THE KERIO RIVER, BARINGO DISTRICT, KENYA. null, null.",01259a0cb2431834302abe2df60a1327,earthchem_export_jul15_26_51025,CIB
https://www.earthchem.org/petdb/citation/01386bd6d8e091c2ab4c7c7de644d37b,"Hedge, C. E., Peterman, Z. E. (1970). THE STRONTIUM ISOTOPIC COMPOSITION OF BASALTS FROM THE GORDA AND JUAN DE FUCA RISES, NORTHEASTERN PACIFIC OCEAN. CONTRIB MINERAL PETROL, 27, 114-120.",01386bd6d8e091c2ab4c7c7de644d37b,earthchem_export_jul14_26_14620,MORB
https://www.earthchem.org/petdb/citation/0172d289da48c48de8c5ebf3de9f7ee1,"Bailey, K. (1976). POTASSIUM-ARGON AGES FROM THE GALAPAGOS ISLANDS. SCIENCE, 192(4238), 467.",0172d289da48c48de8c5ebf3de9f7ee1,earthchem_export_jul15_26_51427,OIB
https://www.earthchem.org/petdb/citation/019d385eb67632a7e958e23f24bd07d7,"Hekinian, R. (1968). ROCKS FROM THE MID-OCEAN RIDGE IN THE INDIAN OCEAN. DEEP SEA RESEARCH, 15, 195-213.",019d385eb67632a7e958e23f24bd07d7,earthchem_export_jul14_26_14620,MORB
https://www.earthchem.org/petdb/citation/01d8bae291b1e4724443375634ccfa0e,"Gurenko, A. A., Hoernle, K., ... Schmincke, H. U. (2010). SOURCE COMPONENTS OF THE GRAN CANARIA (CANARY ISLANDS) SHIELD STAGE MAGMAS: EVIDENCE FROM OLIVINE COMPOSITION AND Sr-Nd-Pb ISOTOPES. CONTRIB MINERAL PETROL, 159, 689-702.",01d8bae291b1e4724443375634ccfa0e,earthchem_export_jul15_26_51427,OIB
https://www.earthchem.org/petdb/citation/01e9565cecc4e989123f9620c1d09c09,"Heatherington, A. L., Mueller, P. A. (1991). GEOCHEMICAL EVIDENCE FOR TRIASSIC RIFTING IN SOUTHWESTERN FLORIDA. TECTONOPHYSICS, 188, 291-302.",01e9565cecc4e989123f9620c1d09c09,earthchem_export_jul15_26_51025,CIB
https://www.earthchem.org/petdb/citation/021bbc7ee20b71134d53e20206bd6feb,"Erzinger, J., Bach, W. (1995). VOLATILE COMPONENTS IN BASALTS AND BASALTIC GLASSES FROM THE EPR AT 9 DEG 30 N. PROC ODP, SCI RESULTS, 142, 23-29.",021bbc7ee20b71134d53e20206bd6feb,earthchem_export_jul14_26_14620,MORB
https://www.earthchem.org/petdb/citation/028ee724157b05d04e7bdcf237d12e60,"Machida, S., Orihashi, Y., ... Tamaki, K. (2014). REGIONAL MANTLE HETEROGENEITY REGULATES MELT PRODUCTION ALONG THE REUNION HOTSPOT-INFLUENCED CENTRAL INDIAN RIDGE. GEOCHEM J, 48, 17.",028ee724157b05d04e7bdcf237d12e60,earthchem_export_jul14_26_14620,MORB
https://www.earthchem.org/petdb/citation/02e74f10e0327ad868d138f2b4fdd6f0,"Erlank, A. J., Reid, A. M., ... Dick, H. J. B. (1982). FERROBASALT FROM THE SPIESS RIDGE SEGMENT OF THE SOUTHWEST INDIAN RIDGE. EARTH PLANET SCI LETT, 60, 437-451.",02e74f10e0327ad868d138f2b4fdd6f0,earthchem_export_jul14_26_14620,MORB
https://www.earthchem.org/petdb/citation/02f657d55eaf1c4840ce8d66fcdaf90c,"Delong, S. E. (1974). DISTRIBUTION OF RB, SR AND NI IN IGNEOUS ROCKS, CENTRAL AND WESTERN ALEUTIAN ISLANDS, ALASKA. GEOCHIM COSMOCHIM ACTA, 38(2), 266.",02f657d55eaf1c4840ce8d66fcdaf90c,earthchem_export_jul15_26_5343,ARC
https://www.earthchem.org/petdb/citation/0314c9b108b8c39f1cf878ed93fdd5ae,"Sun, P., Niu, Y., ... Xiao, Y. (2020). LARGE IRON ISOTOPE VARIATION IN THE EASTERN PACIFIC MANTLE AS A CONSEQUENCE OF ANCIENT LOW-DEGREE MELT METASOMATISM. GEOCHIMICA ET COSMOCHIMICA ACTA, 286, 269-288.",0314c9b108b8c39f1cf878ed93fdd5ae,earthchem_export_jul14_26_14620,MORB
https://www.earthchem.org/petdb/citation/0336dcbab05b9d5ad24f4333c7658a0e,"Hays, E. E., Nicholls, G. D., ... Nalwalk, A. J. (1964). THE NATURE AND COMPOSITION OF ROCK SAMPLES DREDGED FROM THE MID-ATLANTIC RIDGE BETWEEN 22 DEGREE N AND 52 DEGREE N. MARINE GEOLOGY, 1, 333-343.",0336dcbab05b9d5ad24f4333c7658a0e,earthchem_export_jul14_26_14620,MORB
https://www.earthchem.org/petdb/citation/038d5463327addf90d282c35be4c5eb1,"Xiaohui, L. (2024). https://ecl.earthchem.org/view.php?id=3107. null, null.",038d5463327addf90d282c35be4c5eb1,earthchem_export_jul15_26_5343,ARC
https://www.earthchem.org/petdb/citation/03e0704b5690a2dee1861dc3ad3316c9,"Stakes, D., Franklin, J. M. (1994). PETROLOGY OF IGNEOUS ROCKS AT MIDDLE VALLEY, JUAN DE FUCA RIDGE. PROC ODP, SCI RESULTS, 139, 79-102.",03e0704b5690a2dee1861dc3ad3316c9,earthchem_export_jul14_26_14620,MORB
https://www.earthchem.org/petdb/citation/044a23cadb567653eb51d4eb40acaa88,"Baitis, H. W., Lindstrom, M. (1980). GEOLOGY, PETROGRAPHY, AND PETROLOGY OF PINZON ISLAND, GALAPAGOS ARCHIPELAGO. CONTRIB MINERAL PETROL, 72(4), 386.",044a23cadb567653eb51d4eb40acaa88,earthchem_export_jul15_26_51427,OIB
https://www.earthchem.org/petdb/citation/045117b0e0a11a242b9765e79cbf113f,"Graham, A. L., Nicholls, G. D. (1969). MASS SPECTROGRAPHIC DETERMINATION OF LANTHANIDE ELEMENT CONTENTS IN BASALTS. GEOCHIM COSMOCHIM ACTA, 33, 555-568.",045117b0e0a11a242b9765e79cbf113f,earthchem_export_jul14_26_14620,MORB
https://www.earthchem.org/petdb/citation/04c6906524cd877e833fe26ddaddc62f,"Boccaletti, M., Mazzuoli, R., ... Abebe, B. (1999). PLIO-QUATERNARY VOLCANOTECTONIC ACTIVITY IN THE NORTHERN SECTOR OF THE MAIN ETHIOPIAN RIFT: RELATIONSHIPS WITH OBLIQUE RIFTING. JOURNAL OF AFRICAN EARTH SCIENCES, 29(4), 679-698.",04c6906524cd877e833fe26ddaddc62f,earthchem_export_jul15_26_51025,CIB
https://www.earthchem.org/petdb/citation/051e4e127b92f5d98d3c79b195f2b291,"Eissen, J. P. (1982). PETROLOGIE COMPAREE DE BASALTES DE DIFFERENTS SEGMENTS DE ZONES D'ACCRETION OCEANIQUE Ë TAUX D'ACCRETION VARIES (MER ROUGE, ATLANTIQUE, PACIFIQUE). THESIS OR DISSERTATION, DOCTORAL, UNIV STRASBOURG; MONOGRAPHIC",051e4e127b92f5d98d3c79b195f2b291,earthchem_export_jul14_26_14620,MORB
https://www.earthchem.org/petdb/citation/060ad92489947d410d897474079c1477,"Schilling, J., Hanan, B. B., ... Kingsley, R. H. (1986). PB ISOTOPE EVIDENCE IN THE SOUTH ATLANTIC FOR MIGRATING RIDGE-HOT SPOT INTERACTIONS. NATURE, 322, 137-144.",060ad92489947d410d897474079c1477,earthchem_export_jul14_26_14620,MORB
https://www.earthchem.org/petdb/citation/061412e4a03c02f9902576ec55ebbe77,"Paster, T. P. (1968). PETROLOGIC VARIATIONS WITHIN SUBMARINE BASALT PILLOWS OF THE SOUTH PACIFIC-ANTARCTIC OCEAN. THESIS OR DISSERTATION, DOCTORAL, FLORIDA STATE UNIV; MONOGRAPHIC ",061412e4a03c02f9902576ec55ebbe77,earthchem_export_jul14_26_14620,MORB
https://www.earthchem.org/petdb/citation/06409663226af2f3114485aa4e0a23b4,"Graham, D. G., Delaney, J. R., ... Muenow, D. W. (1978). ABUNDANCE AND DISTRIBUTION OF WATER, CARBON AND SULFUR IN THE GLASSY RIMS OF SUBMARINE PILLOW BASALTS. GEOCHIM COSMOCHIM ACTA, 42, 581-594.",06409663226af2f3114485aa4e0a23b4,earthchem_export_jul14_26_14620,MORB
https://www.earthchem.org/petdb/citation/069059b7ef840f0c74a814ec9237b6ec,"Havens, R. G., Engel, A. E. J., ... Engel, C. G. (1965). CHEMICAL CHARACTERISTICS OF OCEANIC BASALTS AND THE UPPER MANTLE. GEOL SOC AMER BULL, 76, 719-734.",069059b7ef840f0c74a814ec9237b6ec,earthchem_export_jul14_26_14620,MORB
https://www.earthchem.org/petdb/citation/069059b7ef840f0c74a814ec9237b6ec,"Havens, R. G., Engel, A. E. J., ... Engel, C. G. (1965). CHEMICAL CHARACTERISTICS OF OCEANIC BASALTS AND THE UPPER MANTLE. GEOL SOC AMER BULL, 76, 719-734.",069059b7ef840f0c74a814ec9237b6ec,earthchem_export_jul15_26_51427,OIB
https://www.earthchem.org/petdb/citation/069d3bb002acd8d7dd095917f9efe4cb,"Jochum, K. P., Verma, S. P. (1996). EXTREME ENRICHMENT OF SB, TL AND OTHER TRACE ELEMENTS IN ALTERED MORB. CHEMICAL GEOLOGY, 130, 289-299.",069d3bb002acd8d7dd095917f9efe4cb,earthchem_export_jul14_26_14620,MORB
https://www.earthchem.org/petdb/citation/06f7c042b76e4b04f698c75b7b2777ea,"Hu, H., Yu, X., ... Hu, H. (2025). MAGMA EVOLUTION ALONG DETACHMENT FAULT-AFFECTED RIDGE SEGMENTS: PETROLOGY AND GEOCHEMISTRY OF MORBS FROM THE TIANXIU SEGMENT, CARLSBERG RIDGE. LITHOS, 494-495, 107917.",06f7c042b76e4b04f698c75b7b2777ea,earthchem_export_jul14_26_14620,MORB
https://www.earthchem.org/petdb/citation/070dbb6024b5ef93784428afc71f2146,"Ayuso, R. A., Haeussler, P., ... Wandless, G. (2009). THE ROLE OF RIDGE SUBDUCTION IN DETERMINING THE GEOCHEMISTRY AND ND–SR–PB ISOTOPIC EVOLUTION OF THE KODIAK BATHOLITH IN SOUTHERN ALASKA. TECTONOPHYSICS, 464(1-4), 163.",070dbb6024b5ef93784428afc71f2146,earthchem_export_jul15_26_5343,ARC
https://www.earthchem.org/petdb/citation/072b030ba126b2f4b2374f342be9ed44,"Schilling, J. (1975). RARE-EARTH VARIATIONS ACROSS NORMAL SEGMENTS OF THE REYKJANES RIDGE, 60 DEGREE -53 DEGREE N, MID-ATLANTIC RIDGE, 29 DEGREE S, AND THE EAST PACIFIC RISE, 2 DEGREE -19 DEGREE S, AND EVIDENCE ON THE COMPOSITION OF THE UNDERLYING LOW-VELOCITY LAYER. J GEOPHYS RES, 80, 1459-1473.",072b030ba126b2f4b2374f342be9ed44,earthchem_export_jul14_26_14620,MORB
https://www.earthchem.org/petdb/citation/0738069b244a1c43c83112b735140a16,"Maier, W. D., Marsh, J. S., ... Barnes, S. (2003). THE CONCENTRATIONS OF THE NOBLE METALS IN SOUTHERN AFRICAN FLOOD-TYPE BASALTS AND MORB: IMPLICATIONS FOR PETROGENESIS AND MAGMATIC SULPHIDE EXPLORATION. CONTRIB MINERAL PETROL, 146(1), 61.",0738069b244a1c43c83112b735140a16,earthchem_export_jul15_26_5343,ARC
https://www.earthchem.org/petdb/citation/0747b9be4f90056c30eb5241f06bfe9b,"George, R., Turner, S., ... Dreher, S. T. (2004). CHEMICAL VERSUS TEMPORAL CONTROLS ON THE EVOLUTION OF THOLEIITIC AND CALC-ALKALINE MAGMAS AT TWO VOLCANOES IN THE ALASKA-ALEUTIAN ARC. J PETROL, 45(1), 219.",0747b9be4f90056c30eb5241f06bfe9b,earthchem_export_jul15_26_5343,ARC
https://www.earthchem.org/petdb/citation/0777d5c17d4066b82ab86dff8a46af6f,"Liias, R. A., Rhodes, J. M., ... Morgan, C. (1990). GEOCHEMISTRY OF AXIAL SEAMOUNT LAVAS: MAGMATIC RELATIONSHIP BETWEEN THE COBB HOTSPOT AND THE JUAN DE FUCA RIDGE. J GEOPHYS RES, 95, 12713-12733.",0777d5c17d4066b82ab86dff8a46af6f,earthchem_export_jul14_26_14620,MORB
https://www.earthchem.org/petdb/citation/07cdfd23373b17c6b337251c22b7ea57,"Fisher, R. L., Hedge, C. E., ... Futa, K. (1979). THE RARE EARTH ABUNDANCES AND RB-SR SYSTEMATICS OF BASALTS, GABBRO, ANORTHOSITE AND MINOR GRANITE ROCKS FROM THE INDIAN OCEAN RIDGE SYSTEM, WESTERN INDIAN OCEAN. CONTRIB MINERAL PETROL, 68, 373-376.",07cdfd23373b17c6b337251c22b7ea57,earthchem_export_jul14_26_14620,MORB
https://www.earthchem.org/petdb/citation/07e1cd7dca89a1678042477183b7ac3f,"Schilling, J., Yu, D., ... Fontignie, D. (1997). MANTLE PLUME - RIDGE INTERACTIONS IN THE CENTRAL NORTH ATLANTIC: A ND ISOTOPE STUDY OF MID-ATLANTIC RIDGE BASALTS FROM 30 DEGREE N TO 50 DEGREE N. EARTH PLANET SCI LETT, 146, 259-272.",07e1cd7dca89a1678042477183b7ac3f,earthchem_export_jul14_26_14620,MORB
https://www.earthchem.org/petdb/citation/084afd913ab1e6ea58b8ca73f6cb41a6,"Brotzu, P., Morbidelli, L., ... Traversa, G. (1984). MIOCENE TO QUATERNARY VOLCANISM IN EASTERN KENYA: SEQUENCE AND GEOCHRONOLOGY. TECTONOPHYSICS, 101(1-2), 75-86.",084afd913ab1e6ea58b8ca73f6cb41a6,earthchem_export_jul15_26_51025,CIB
https://www.earthchem.org/petdb/citation/084b6fbb10729ed4da8c3d3f5a3ae7c9,"O'nions, R. K., Pankhurst, R. J. (1974). PETROGENETIC SIGNIFICANCE OF ISOTOPE AND TRACE ELEMENT VARIATIONS IN VOLCANIC ROCKS FROM THE MID-ATLANTIC. J PETROL, 15, 603-634.",084b6fbb10729ed4da8c3d3f5a3ae7c9,earthchem_export_jul14_26_14620,MORB
https://www.earthchem.org/petdb/citation/084b6fbb10729ed4da8c3d3f5a3ae7c9,"O'nions, R. K., Pankhurst, R. J. (1974). PETROGENETIC SIGNIFICANCE OF ISOTOPE AND TRACE ELEMENT VARIATIONS IN VOLCANIC ROCKS FROM THE MID-ATLANTIC. J PETROL, 15, 603-634.",084b6fbb10729ed4da8c3d3f5a3ae7c9,earthchem_export_jul15_26_51427,OIB
https://www.earthchem.org/petdb/citation/08c5433a60135c32e34f46a71175850c,"Halliday, A. N., Lee, D. C., ... James, D. E. (1995). INCOMPATIBLE TRACE ELEMENTS IN OIB AND MORB AND SOURCE ENRICHMENT IN THE SUB-OCEANIC MANTLE. EARTH PLANET SCI LETT, 133, 379-395.",08c5433a60135c32e34f46a71175850c,earthchem_export_jul15_26_51427,OIB
https://www.earthchem.org/petdb/citation/09ba3f0df1447f40e98674ba9d62c747,"Konrad, K., Graham, D. W., ... Koppers, A. (2017). SPATIAL AND TEMPORAL VARIABILITY IN MARQUESAS ISLANDS VOLCANISM REVEALED BY  3 HE/ 4 HE AND THE COMPOSITION OF OLIVINE-HOSTED MELT INCLUSIONS. CHEMICAL GEOLOGY, 477",09ba3f0df1447f40e98674ba9d62c747,earthchem_export_jul15_26_51427,OIB
https://www.earthchem.org/petdb/citation/09c6c3783b4a70054da74f2538ed47c6,"Sours-page, R. E., Nielsen, R. L., ... Batiza, R. (2002). MELT INCLUSIONS AS INDICATORS OF PARENTAL MAGMA DIVERSITY ON THE NORTHERN EAST PACIFIC RISE. CHEMICAL GEOLOGY, 183, 237-261.",09c6c3783b4a70054da74f2538ed47c6,earthchem_export_jul14_26_14620,MORB
https://www.earthchem.org/petdb/citation/0afa92fc0f8a9cf051bf2961b06ac56b,"Nielsen, S., Geldmacher, J., ... Kading, T. (2016). TRACKING ALONG-ARC SEDIMENT INPUTS TO THE ALEUTIAN ARC USING THALLIUM ISOTOPES. GEOCHIM COSMOCHIM ACTA, 181, 237.",0afa92fc0f8a9cf051bf2961b06ac56b,earthchem_export_jul15_26_5343,ARC
https://www.earthchem.org/petdb/citation/0bd65e799153554726820ca639514029,"Curtis, G., Evernden, J. (1962). AGE OF BASALT UNDERLYING BED I, OLDUVAI. NATURE, 194(4828), 611-612.",0bd65e799153554726820ca639514029,earthchem_export_jul15_26_51025,CIB
https://www.earthchem.org/petdb/citation/0c6b6f19684ed9b6ff07575fcf81c98d,"Gill, J. B. (2020). Compilation of whole rock geochemistry and petrography of samples from the Sangihe Arc, northern Sulawesi, Indonesia. null, null.",0c6b6f19684ed9b6ff07575fcf81c98d,earthchem_export_jul15_26_51427,OIB
https://www.earthchem.org/petdb/citation/0c8ce55163055c4da50a81e0a273468c,"O'connor, J., Jokat, W., ... Class, C. (2010). SHONA AND DISCOVERY ASEISMIC RIDGE SYSTEMS, SOUTH ATLANTIC: TRACE ELEMENT EVIDENCE FOR ENRICHED MANTLE SOURCES. J PETROL, 51(10), 2089-2120.",0c8ce55163055c4da50a81e0a273468c,earthchem_export_jul14_26_14620,MORB
https://www.earthchem.org/petdb/citation/0d27688c61c5a172e8e45956cd70cba2,"Rutford, R. (2007). JONES MOUNTAINS, ANTARCTICA: EVIDENCE FOR TERTIARY GLACIATION REVISITED. null, null.",0d27688c61c5a172e8e45956cd70cba2,earthchem_export_jul15_26_51025,CIB
https://www.earthchem.org/petdb/citation/0d441de75945e5acbc865406fc9a2559,"Creon, L., Levresse, G., ... Remusat, L. (2018). EVIDENCE OF A SHALLOW MAGMA RESERVOIR BELOW LOS HUMEROS VOLCANIC COMPLEX: INSIGHTS FROM THE GEOCHEMISTRY OF SILICATE MELT INCLUSIONS. JOURNAL OF SOUTH AMERICAN EARTH SCIENCES, 88, 446-458.",0d441de75945e5acbc865406fc9a2559,earthchem_export_jul15_26_5343,ARC
https://www.earthchem.org/petdb/citation/0d9095b0d6bbe98ea0c9c02b11b59ee3,"Geist, D. J., Diefenbach, B., ... Blusztajn, J. (2008). CONSTRUCTION OF THE GALÁPAGOS PLATFORM BY LARGE SUBMARINE VOLCANIC TERRACES. GEOCHEM GEOPHYS GEOSYST, 9(3)",0d9095b0d6bbe98ea0c9c02b11b59ee3,earthchem_export_jul14_26_14620,MORB
https://www.earthchem.org/petdb/citation/0dbb3fb9a5cd1d5f8a9075b5bb8070aa,"Plechov, P., Blundy, J. D., ... Tikhonova, E. (2015). PETROLOGY AND VOLATILE CONTENT OF MAGMAS ERUPTED FROM TOLBACHIK VOLCANO, KAMCHATKA, 2012–13. JOURNAL OF VOLCANOLOGY AND GEOTHERMAL RESEARCH, 307, 182-199.",0dbb3fb9a5cd1d5f8a9075b5bb8070aa,earthchem_export_jul15_26_5343,ARC
https://www.earthchem.org/petdb/citation/0e64a7b00c83e3d22ce6b3acf2c582b6,"Caracciolo, A., Marshall, E. W., ... Runarsdottir, R. (2025). Geochemical dataset of bulk and in-situ analyses for the 2022 and 2023 Fagradalsfjall eruption, Iceland. null, null.",0e64a7b00c83e3d22ce6b3acf2c582b6,earthchem_export_jul14_26_14620,MORB
https://www.earthchem.org/petdb/citation/0efe32849d230d7f53049ddc4a4b0c60,"Eissen, J. P., Juteau, T., ... Bideau, R. D. (1981). PRESENCE DE BASALTES PORPHYRIQUES DANS LES ZONES DE FRACTURE DE LA DORSALE EST PACIFIQUE. COMPT REND ACAD SCI PARIS, SER II, 293, 61-66.",0efe32849d230d7f53049ddc4a4b0c60,earthchem_export_jul14_26_14620,MORB
https://www.earthchem.org/petdb/citation/0f28b5d49b3020afeecd95b4009adf4c,"Moore, J. G., Schilling, J. (1973). VESICLES, WATER AND SULFUR IN REYKJANES RIDGE BASALTS. CONTRIB MINERAL PETROL, 41, 105-118.",0f28b5d49b3020afeecd95b4009adf4c,earthchem_export_jul14_26_14620,MORB
https://www.earthchem.org/petdb/citation/0f65caf0a7d00afd2b87c028e88fe931,"Brown, F. (1994). DEVELOPMENT OF PLIOCENE AND PLEISTOCENE CHRONOLOGY OF THE TURKANA BASIN, EAST AFRICA, AND ITS RELATION TO OTHER SITES. null, 285-312.",0f65caf0a7d00afd2b87c028e88fe931,earthchem_export_jul15_26_51025,CIB
https://www.earthchem.org/petdb/citation/0fc170ecbb8ff1afb2c6de48ea5343e7,"Naumann, T., Geist, D. J., ... Kurz, M. D. (2002). PETROLOGY AND GEOCHEMISTRY OF VOLCAN CERRO AZUL: PETROLOGIC DIVERSITY AMONG THE WESTERN GALAPAGOS VOLCANOES. J PETROL, 43(5), 883.",0fc170ecbb8ff1afb2c6de48ea5343e7,earthchem_export_jul15_26_51427,OIB
https://www.earthchem.org/petdb/citation/0fcbc61acd0479dc77e3cccc0f5ffca7,"Cann, J. R., Vine, F. J. (1966). AN AREA ON THE CREST OF THE CARLSBERG RIDGE; PETROLOGY AND MAGNETIC SURVEY. PHIL TRANS R SOC LOND, A259, 198-217.",0fcbc61acd0479dc77e3cccc0f5ffca7,earthchem_export_jul14_26_14620,MORB
https://www.earthchem.org/petdb/citation/1006ff12c465532f8c574aeaa4461b16,"White, W. M., Mcbirney, A. R., ... Duncan, R. A. (1993). PETROLOGY AND GEOCHEMISTRY OF THE GALAPAGOS ISLANDS: PORTRAIT OF A PATHOLOGICAL MANTLE PLUME. J GEOPHYS RES, 98(B11), 19563.",1006ff12c465532f8c574aeaa4461b16,earthchem_export_jul15_26_51427,OIB
https://www.earthchem.org/petdb/citation/109a0ca3bc27f3e96597370d5c8cf03d,"Lonsdale, P. F., Allan, J. F., ... Batiza, R. (1987). PETROLOGY AND CHEMISTRY OF LAVAS FROM SEAMOUNTS FLANKING THE EAST PACIFIC RISE AXIS, 21 DEG N: IMPLICATIONS CONCERNING THE MANTLE SOURCE COMPOSITION FOR BOTH SEAMOUNT AND ADJACENT EPR LAVAS. AGU GEOPHYS MONOGR, 43, 255-282.",109a0ca3bc27f3e96597370d5c8cf03d,earthchem_export_jul14_26_14620,MORB
https://www.earthchem.org/petdb/citation/109d2dd3608f669ca17920c511c2a41e,"Merle, R., Marzoli, A., ... Ernesto, M. (2011). 40Ar/39Ar AGES AND Sr-Nd-Pb-Os GEOCHEMISTRY OF CAMP THOLEIITES FROM WESTERN MARANHAO BASIN (NE BRAZIL). LITHOS, 122, 137-151.",109d2dd3608f669ca17920c511c2a41e,earthchem_export_jul15_26_51025,CIB
https://www.earthchem.org/petdb/citation/115f89503138416a242f40fb7d7f338e,"Hekinian, R., Fouquet, Y. (1985). VOLCANISM AND METALLOGENESIS OF AXIAL AND OFF-AXIAL STRUCTURES ON THE EAST PACIFIC RISE NEAR 13 DEGREE N. ECON GEOL, 80, 221-249.",115f89503138416a242f40fb7d7f338e,earthchem_export_jul14_26_14620,MORB
https://www.earthchem.org/petdb/citation/125c0e943c73bb8a0840ab524fdcbd08,"Curtis, G., Hay, R. (1972). FURTHER GEOLOGICAL STUDIES AND POTASSIUM-ARGON DATING AT OLDUVAI GORGE AND NGORONGORO CRATER. null, 107-134.",125c0e943c73bb8a0840ab524fdcbd08,earthchem_export_jul15_26_51025,CIB
https://www.earthchem.org/petdb/citation/1264a061d82a2edae1574b07249800d6,"Yogodzinski, G., Brown, S. T., ... Werner, R. (2015). THE ROLE OF SUBDUCTED BASALT IN THE SOURCE OF ISLAND ARC MAGMAS: EVIDENCE FROM SEAFLOOR LAVAS OF THE WESTERN ALEUTIANS. J PETROL, 56, 441-492.",1264a061d82a2edae1574b07249800d6,earthchem_export_jul15_26_5343,ARC
https://www.earthchem.org/petdb/citation/12e086066892a311b752673a28583d3f,"Reagan, M. K., Pearce, J. A., ... Whattam, S. (2015). SITE U1442. PROCEEDINGS OF THE INTERNATIONAL OCEAN DISCOVERY PROGRAM, 352",12e086066892a311b752673a28583d3f,earthchem_export_jul15_26_5343,ARC
https://www.earthchem.org/petdb/citation/1305f6c705349316360c3ccfe7cfe847,"Peters, B. J., Shahar, A., ... Mock, T. D. (2019). A SULFIDE PERSPECTIVE ON IRON ISOTOPE FRACTIONATION DURING OCEAN ISLAND BASALT PETROGENESIS. GEOCHIMICA ET COSMOCHIMICA ACTA, 245, 59-78.",1305f6c705349316360c3ccfe7cfe847,earthchem_export_jul15_26_51427,OIB
https://www.earthchem.org/petdb/citation/13111c20aee51aeb480ecbd988cd8cc9,"Geldmacher, J., Hoefig, T., ... Wilson, D. S. (2013). INFLUENCE OF THE GALAPAGOS HOTSPOT ON THE EAST PACIFIC RISE DURING MIOCENE SUPERFAST SPREADING. GEOLOGY, 41(2), 183-186.",13111c20aee51aeb480ecbd988cd8cc9,earthchem_export_jul14_26_14620,MORB
https://www.earthchem.org/petdb/citation/133b3752e52bae42230364cb720f81f7,"Labidi, J., Cartigny, P. (2016). NEGLIGIBLE SULFUR ISOTOPE FRACTIONATION DURING PARTIAL MELTING: EVIDENCE FROM GARRETT TRANSFORM FAULT BASALTS, IMPLICATIONS FOR THE LATE-VENEER AND THE HADEAN MATTE. EARTH PLANET SCI LETT, 451, 207.",133b3752e52bae42230364cb720f81f7,earthchem_export_jul14_26_14620,MORB
https://www.earthchem.org/petdb/citation/1343777b8ead1cef5a79b78a1a48d805,"Mollel, G. F., Feigenson, M. D., ... Swisher Iii, C. C. (2008). GEOCHEMICAL EVOLUTION OF NGORONGORO CALDERA, NORTHERN TANZANIA: IMPLICATIONS FOR CRUST–MAGMA INTERACTION. EARTH AND PLANETARY SCIENCE LETTERS, 271(1-4), 337-347.",1343777b8ead1cef5a79b78a1a48d805,earthchem_export_jul15_26_51025,CIB
https://www.earthchem.org/petdb/citation/1373b284bc381890049e92d324f56de0,"Plank, T., Wade, J. A., ... Hilton, D. R. (2005). THE MAY 2003 ERUPTION OF ANATAHAN VOLCANO, MARIANA ISLANDS: GEOCHEMICAL EVOLUTION OF A SILICIC ISLAND-ARC VOLCANO. J VOLCANOL GEOTHERM RES, 146, 139-170.",1373b284bc381890049e92d324f56de0,earthchem_export_jul15_26_5343,ARC
https://www.earthchem.org/petdb/citation/13f3cf8c531952d72e5847c4183e6910,"Macdougall, J. D., Spencer, K., ... Sinton, J. M. (1993). ISOTOPE AND TRACE ELEMENT CHARACTERISTICS OF A SUPER-FAST SPREADING RIDGE: EAST PACIFIC RISE 13-23 DEGREE S. EARTH PLANET SCI LETT, 121, 171-191.",13f3cf8c531952d72e5847c4183e6910,earthchem_export_jul14_26_14620,MORB
https://www.earthchem.org/petdb/citation/147540e129e096fa91700e9db6588354,"Keller, R. A., Fisk, M. R., ... Lawver, L. (2002). GEOCHEMISTRY OF BACK ARC BASIN VOLCANISM IN BRANSFIELD STRAIT, ANTARCTICA: SUBDUCTED CONTRIBUTIONS AND ALONG-AXIS VARIATIONS. JOURNAL OF GEOPHYSICAL RESEARCH, 107(B8), null.",147540e129e096fa91700e9db6588354,earthchem_export_jul15_26_5343,ARC
https://www.earthchem.org/petdb/citation/148510031349642de5ca0c544f31b2ef,"Barnes, J. D., Cisneros, M. (2012). MINERALOGICAL CONTROL ON THE CHLORINE ISOTOPE COMPOSITION OF ALTERED OCEANIC CRUST. CHEMICAL GEOLOGY, 326-327, 51-60.",148510031349642de5ca0c544f31b2ef,earthchem_export_jul14_26_14620,MORB
https://www.earthchem.org/petdb/citation/149e9677a5989fd342ae44213df68868,"Aumento, F. (1968). THE MID-ATLANTIC RIDGE NEAR 45 DEGREE N  II. BASALTS FROM THE AREA OF CONFEDERATION PEAK. CAN J EARTH SCI, 5, 1-21.",149e9677a5989fd342ae44213df68868,earthchem_export_jul14_26_14620,MORB
https://www.earthchem.org/petdb/citation/149ef6419512be56a93169cd5e6fa8fd,"El-hinnawi, E. (1964). PETROCHEMICAL CHARACTERS OF AFRICAN VOLCANIC ROCKS. NEUES JAHRBUCH FÜR MINERALOGIE. MONATSHEFTE, INHALT, (3), 65-81.",149ef6419512be56a93169cd5e6fa8fd,earthchem_export_jul15_26_51025,CIB
https://www.earthchem.org/petdb/citation/14bfa6bb14875e45bba028a21ed38046,"Futa, K., Batiza, R., ... Oestrike, R. (1982). CHEMICAL AND ISOTOPIC DIVERSITY IN BASALTS DREDGED FROM THE EAST PACIFIC RISE AT 10 DEGREE S, THE FOSSIL GALAPAGOS RISE AND THE NAZCA PLATE. MARINE GEOLOGY, 49, 115-132.",14bfa6bb14875e45bba028a21ed38046,earthchem_export_jul14_26_14620,MORB
https://www.earthchem.org/petdb/citation/1543843a4723ed2ab08e18053ae6dc5b,"Ryan, J. G., Langmuir, C. H. (1987). THE SYSTEMATICS OF LITHIUM ABUNDANCES IN YOUNG VOLCANIC ROCKS. GEOCHIM COSMOCHIM ACTA, 51, 1727-1741.",1543843a4723ed2ab08e18053ae6dc5b,earthchem_export_jul14_26_14620,MORB
https://www.earthchem.org/petdb/citation/159c1ffe5b61b41b3c4d8f4c2150f6c4,"Sosa, E., Bucholz, C., ... Kay, R. (2024). LOWER CRUSTAL CONTROL IN THE IRON ISOTOPE SYSTEMATICS OF PLUTONIC XENOLITHS FROM ADAK ISLAND, CENTRAL ALEUTIANS, WITH IMPLICATIONS FOR ARC MAGMA GEOCHEMISTRY. GEOCHIMICA ET COSMOCHIMICA ACTA, (377), 1-18.",159c1ffe5b61b41b3c4d8f4c2150f6c4,earthchem_export_jul15_26_5343,ARC
https://www.earthchem.org/petdb/citation/15d4e891d784977cacbfcbb00c48f133,"Fontignie, D., Schilling, J. (1991). 87SR/86SR AND REE VARIATIONS ALONG THE EASTER MICROPLATE BOUNDARIES (SOUTH PACIFIC): APPLICATION OF MULTIVARIATE STATISTICAL ANALYSES TO RIDGE SEGMENTATION. CHEMICAL GEOLOGY, 89, 209-241.",15d4e891d784977cacbfcbb00c48f133,earthchem_export_jul14_26_14620,MORB
https://www.earthchem.org/petdb/citation/15e122e839dfdaa7ce969536f94aecf6,"Tolstykh, M., Pevzner, M., ... Kononkova, N. N. (2015). TYPES OF PARENTAL MELTS OF PYROCLASTIC ROCKS OF VARIOUS STRUCTURAL–AGE COMPLEXES OF THE SHIVELUCH VOLCANIC MASSIF, KAMCHATKA: EVIDENCE FROM INCLUSIONS IN MINERALS. PETROLOGY, 23(5), 480-517.",15e122e839dfdaa7ce969536f94aecf6,earthchem_export_jul15_26_5343,ARC
https://www.earthchem.org/petdb/citation/1651cf0d2f737d7adeab84d339dbabd3,"Altherr, R., Baumann, A., ... Henjes-kunst, F. (1988). VOLCANIC ACTIVITY IN THE RED SEA AXIAL TROUGH - EVIDENCE FOR A LARGE MANTLE DIAPIR?. TECTONOPHYSICS, 150, 121-133.",1651cf0d2f737d7adeab84d339dbabd3,earthchem_export_jul14_26_14620,MORB
https://www.earthchem.org/petdb/citation/1679091c5a880faf6fb5e6087eb1b2dc,"Rindge, S., Thompson, G., ... Frey, F. A. (1981). MINOR AND TRACE ELEMENT GEOCHEMISTRY OF VOLCANIC ROCKS DREDGED FROM THE GALAPAGOS SPREADING CENTER: ROLE OF CRYSTAL FRACTIONATION AND MANTLE HETEROGENEITY. J GEOPHYS RES, 86, 9469-9482.",1679091c5a880faf6fb5e6087eb1b2dc,earthchem_export_jul14_26_14620,MORB
https://www.earthchem.org/petdb/citation/1680829293f2a8541efa2647a0290f88,"Myers, J. D., Frost, C. (1994). A PETROLOGIC RE-INVESTIGATION OF THE ADAK VOLCANIC CENTER, CENTRAL ALEUTIAN ARC, ALASKA. J VOLCANOL GEOTHERM RES, 60(2), 146.",1680829293f2a8541efa2647a0290f88,earthchem_export_jul15_26_5343,ARC
https://www.earthchem.org/petdb/citation/1713a23c14b5033adb074b5464fb6c66,"Roberts, M. (2002). THE GEOCHEMICAL AND VOLCANOLOGICAL EVOLUTION OF THE MT. MERU REGION, NORTHERN TANZANIA. null, null.",1713a23c14b5033adb074b5464fb6c66,earthchem_export_jul15_26_51025,CIB
https://www.earthchem.org/petdb/citation/1731592aca5fb4d789c4119c65c10b4b,"Castillo, P. R., Hilton, D. R., ... Halldorsson, S. (2014). TRACE ELEMENT AND SR-ND-PB ISOTOPE GEOCHEMISTRY OF RUNGWE VOLCANIC PROVINCE, TANZANIA: IMPLICATIONS FOR A SUPERPLUME SOURCE FOR EAST AFRICA RIFT MAGMATISM. FRONTIERS IN EARTH SCIENCE, 2, null.",1731592aca5fb4d789c4119c65c10b4b,earthchem_export_jul15_26_51025,CIB
