citation_url,citation,citation_id,source_export_id,export_label
https://www.earthchem.org/petdb/citation/c74d97b01eae257e44aa9d5bade97baf,"Byerly, G. R., Melson, W. G., ... Vogt, P. R. (1976). RHYODACITES, ANDESITES, FERRO-BASALTS AND OCEAN THOLEIITES FROM THE GALAPAGOS SPREADING CENTER. EARTH PLANET SCI LETT, 30, 215-221.",c74d97b01eae257e44aa9d5bade97baf,earthchem_export_jul14_26_14620,MORB
https://www.earthchem.org/petdb/citation/c78c347465f4775425c059ea101c131f,"Rooney, T., Brown, E., ... Campisano, C. (2023). MAGMATISM DURING THE CONTINENT – OCEAN TRANSITION. EARTH AND PLANETARY SCIENCE LETTERS, 614, 118189.",c78c347465f4775425c059ea101c131f,earthchem_export_jul15_26_51025,CIB
https://www.earthchem.org/petdb/citation/c819904dde95535c60452b16c1c494f6,"Liang, Y., Halliday, A. N., ... Harvey, J. (2017). MOLYBDENUM ISOTOPE FRACTIONATION IN THE MANTLE. GEOCHIM COSMOCHIM ACTA, 199, 111.",c819904dde95535c60452b16c1c494f6,earthchem_export_jul14_26_14620,MORB
https://www.earthchem.org/petdb/citation/c819904dde95535c60452b16c1c494f6,"Liang, Y., Halliday, A. N., ... Harvey, J. (2017). MOLYBDENUM ISOTOPE FRACTIONATION IN THE MANTLE. GEOCHIM COSMOCHIM ACTA, 199, 111.",c819904dde95535c60452b16c1c494f6,earthchem_export_jul15_26_51427,OIB
https://www.earthchem.org/petdb/citation/c82836ed448c41094025b4a872c5341e,"Mcdougall, I., Watkins, R. T. (1988). POTASSIUM–ARGON AGES OF VOLCANIC ROCKS FROM NORTHEAST OF LAKE TURKANA, NORTHERN KENYA. GEOLOGICAL MAGAZINE, 125(01), 15.",c82836ed448c41094025b4a872c5341e,earthchem_export_jul15_26_51025,CIB
https://www.earthchem.org/petdb/citation/c90e274d55309db944076afb3ff9c391,"Kurzweil, F., Muenker, C., ... Schoenberg, R. (2019). THE STABLE TUNGSTEN ISOTOPE COMPOSITION OF MODERN IGNEOUS RESERVOIRS. GEOCHIMICA ET COSMOCHIMICA ACTA, 251, 176-191.",c90e274d55309db944076afb3ff9c391,earthchem_export_jul15_26_5343,ARC
https://www.earthchem.org/petdb/citation/c90e274d55309db944076afb3ff9c391,"Kurzweil, F., Muenker, C., ... Schoenberg, R. (2019). THE STABLE TUNGSTEN ISOTOPE COMPOSITION OF MODERN IGNEOUS RESERVOIRS. GEOCHIMICA ET COSMOCHIMICA ACTA, 251, 176-191.",c90e274d55309db944076afb3ff9c391,earthchem_export_jul15_26_51427,OIB
https://www.earthchem.org/petdb/citation/c96c08f8bb7960e11a1239352a479053,"Jackson, M. G., Halldorsson, S., ... Day, J. M. D. (2020). CONTRASTING OLD AND YOUNG VOLCANISM FROM AITUTAKI, COOK ISLANDS: IMPLICATIONS FOR THE ORIGINS OF THE COOK–AUSTRAL VOLCANIC CHAIN. JOURNAL OF PETROLOGY, 61(3), null.",c96c08f8bb7960e11a1239352a479053,earthchem_export_jul15_26_51427,OIB
https://www.earthchem.org/petdb/citation/c9892a989183de32e976c6f04e700201,"Roy-barman, M., Allegre, C. J. (1994). 187OS/186OS IN OCEANIC MID-OCEAN RIDGE BASALTS AND ABYSSAL PERIDOTITES. GEOCHIM COSMOCHIM ACTA, 58, 5043-5054.",c9892a989183de32e976c6f04e700201,earthchem_export_jul14_26_14620,MORB
https://www.earthchem.org/petdb/citation/ca8155f4d27f205953f9d3d7974bdd70,"Antonini, P., Contin, G., ... Petrini, R. (1998). A SEGMENT OF SEA-FLOOR SPREADING IN THE CENTRAL RED SEA: BASALTS FROM THE NEREUS DEEP (23 DEG 00 MIN - 23 DEG 20 MIN N). J AFRIC EARTH SCI, 27, 107-114.",ca8155f4d27f205953f9d3d7974bdd70,earthchem_export_jul14_26_14620,MORB
https://www.earthchem.org/petdb/citation/ca851e9f71b25d2d588b7e0d4de3d627,"Miyazaki, T., Hanyu, T., ... Sato, T. (2018). CLINOPYROXENE AND BULK ROCK SR–ND–HF–PB ISOTOPE COMPOSITIONS OF RAIVAVAE OCEAN ISLAND BASALTS: DOES CLINOPYROXENE RECORD EARLY STAGE MAGMA CHAMBER PROCESSES?. CHEMICAL GEOLOGY, 482, 31.",ca851e9f71b25d2d588b7e0d4de3d627,earthchem_export_jul15_26_51427,OIB
https://www.earthchem.org/petdb/citation/cb3ce9b06932da6faaa7fc70d5b5d2f4,"Bjerga, A., Stubseid, H., ... Pedersen, R. B. (2022). A HIGHLY DEPLETED AND SUBDUCTION‐MODIFIED MANTLE BENEATH THE SLOW‐SPREADING MOHNS RIDGE. GEOCHEMISTRY, GEOPHYSICS, GEOSYSTEMS, 23(11), null.",cb3ce9b06932da6faaa7fc70d5b5d2f4,earthchem_export_jul14_26_14620,MORB
https://www.earthchem.org/petdb/citation/cb953f6ca5923f7517125db46ed1293d,"Wu, F., Qi, Y., ... Langmuir, C. H. (2018). VANADIUM ISOTOPE COMPOSITIONS OF MID-OCEAN RIDGE LAVAS AND ALTERED OCEANIC CRUST. EARTH AND PLANETARY SCIENCE LETTERS, 493, 128-139.",cb953f6ca5923f7517125db46ed1293d,earthchem_export_jul14_26_14620,MORB
https://www.earthchem.org/petdb/citation/cbb6a3b884f4f88b3a8e3d44c636cbd8,"Saunders, A. D. (1983). GEOCHEMISTRY OF BASALTS RECOVERED FROM THE GULF OF CALIFORNIA DURING LEG 65 OF THE DEEP SEA DRILLING PROJECT. INIT REP DSDP, 65, 591-621.",cbb6a3b884f4f88b3a8e3d44c636cbd8,earthchem_export_jul14_26_14620,MORB
https://www.earthchem.org/petdb/citation/cbfe5681369338a48e2d1b63998099d6,"Belay, I., Tanaka, R., ... Nakamura, E. (2019). ORIGIN OF OCEAN ISLAND BASALTS IN THE WEST AFRICAN PASSIVE MARGIN WITHOUT MANTLE PLUME INVOLVEMENT. NATURE COMMUNICATIONS, 10(1), null.",cbfe5681369338a48e2d1b63998099d6,earthchem_export_jul15_26_5343,ARC
https://www.earthchem.org/petdb/citation/cbfe5681369338a48e2d1b63998099d6,"Belay, I., Tanaka, R., ... Nakamura, E. (2019). ORIGIN OF OCEAN ISLAND BASALTS IN THE WEST AFRICAN PASSIVE MARGIN WITHOUT MANTLE PLUME INVOLVEMENT. NATURE COMMUNICATIONS, 10(1), null.",cbfe5681369338a48e2d1b63998099d6,earthchem_export_jul15_26_51427,OIB
https://www.earthchem.org/petdb/citation/cc7e2b878868cbae992d1fb743995d8f,"Breton, T., Nauret, F., ... Wavrant, L. (2013). GEOCHEMICAL HETEROGENEITIES WITHIN THE CROZET HOSTSPOT. EARTH PLANET SCI LETT, 376, 126-136.",cc7e2b878868cbae992d1fb743995d8f,earthchem_export_jul15_26_51427,OIB
https://www.earthchem.org/petdb/citation/ccc81a97c1535f9a631b9db584a264e4,"Defelice, C., Mallick, S., ... Huang, S. (2019). AN ISOTOPICALLY DEPLETED LOWER MANTLE COMPONENT IS INTRINSIC TO THE HAWAIIAN MANTLE PLUME. NATURE GEOSCIENCE, 12(6), 487-492.",ccc81a97c1535f9a631b9db584a264e4,earthchem_export_jul15_26_51427,OIB
https://www.earthchem.org/petdb/citation/cd0dce8fca267bf1fb86cf43e18d5598,"Busigny, V., Laverne, C., ... Bonifacie, M. (2005). NITROGEN CONTENT AND ISOTOPIC COMPOSITION OF OCEANIC CRUST AT A SUPERFAST SPREADING RIDGE: A PROFILE IN ALTERED BASALTS FROM ODP SITE 1256, LEG 206. GEOCHEM GEOPHYS GEOSYST, 6(12)",cd0dce8fca267bf1fb86cf43e18d5598,earthchem_export_jul14_26_14620,MORB
https://www.earthchem.org/petdb/citation/cd3bbc2d7ca1bbdc055acf58609e6c24,"Mcdougall, I. (1985). K-AR AND 40AR/39AR DATING OF THE HOMINID-BEARING PLIOCENCE-PLEISTOCENE SEQUENCE AT KOOBI FORA, LAKE TURKANA, NORTHERN KENYA. GEOLOGICAL SOCIETY OF AMERICA BULLETIN, 96, 159-175.",cd3bbc2d7ca1bbdc055acf58609e6c24,earthchem_export_jul15_26_51025,CIB
https://www.earthchem.org/petdb/citation/cd4bb35c75ba84b4f39e547b1416fd35,"Kelley, K. A., Kingsley, R. H., ... Schilling, J. (2013). COMPOSITION OF PLUME-INFLUENCED MID-OCEAN RIDGE LAVAS AND GLASSES FROM THE MID-ATLANTIC RIDGE, EAST PACIFIC RISE, GALAPAGOS SPREADING CENTER, AND GULF OF ADEN. GEOCHEM GEOPHYS GEOSYST, 14(1), 223-242.",cd4bb35c75ba84b4f39e547b1416fd35,earthchem_export_jul14_26_14620,MORB
https://www.earthchem.org/petdb/citation/cd4bb35c75ba84b4f39e547b1416fd35,"Kelley, K. A., Kingsley, R. H., ... Schilling, J. (2013). COMPOSITION OF PLUME-INFLUENCED MID-OCEAN RIDGE LAVAS AND GLASSES FROM THE MID-ATLANTIC RIDGE, EAST PACIFIC RISE, GALAPAGOS SPREADING CENTER, AND GULF OF ADEN. GEOCHEM GEOPHYS GEOSYST, 14(1), 223-242.",cd4bb35c75ba84b4f39e547b1416fd35,earthchem_export_jul15_26_51427,OIB
https://www.earthchem.org/petdb/citation/cda72177eba360ff16b7f836e2754370,"Stern, R. J., Kohut, E. J., ... Vervoort, J. (2006). SUBDUCTION FACTORY PROCESSES BENEATH THE GUGUAN CROSS-CHAIN, MARIANA  ARC: NO ROLE FOR SEDIMENTS, ARE SERPENTINITES IMPORTANT?. CONTRIB MINERAL PETROL, 151(2), 202-221.",cda72177eba360ff16b7f836e2754370,earthchem_export_jul15_26_5343,ARC
https://www.earthchem.org/petdb/citation/cdcb2f5c7b071143529ef7f2705dfbc4,"Shimizu, H., Masuda, A., ... Masui, N. (1981). RARE-EARTH ELEMENT GEOCHEMISTRY OF VOLCANIC AND RELATED ROCKS FORM THE GALAPAGOS ISLANDS. GEOCHEM J, 15(2)",cdcb2f5c7b071143529ef7f2705dfbc4,earthchem_export_jul15_26_51427,OIB
https://www.earthchem.org/petdb/citation/ce47be4abd80ac324c645fd57a27fc73,"Koenig, S., Wille, M., ... Schoenberg, R. (2016). MOLYBDENUM ISOTOPE SYSTEMATICS IN SUBDUCTION ZONES. EARTH PLANET SCI LETT, 447, 102.",ce47be4abd80ac324c645fd57a27fc73,earthchem_export_jul15_26_5343,ARC
https://www.earthchem.org/petdb/citation/ce5140df15d046a66883807d18d0264b,"Harpp, K. S. (1995). GEOCHEMICAL VARIATIONS IN A SINGLE BASALTIC FLOW AT 9 DEG 30 N ON THE EAST PACIFIC RISE. PROC ODP, SCI RESULTS, 142, 9-22.",ce5140df15d046a66883807d18d0264b,earthchem_export_jul14_26_14620,MORB
https://www.earthchem.org/petdb/citation/cec6f62cfb44b1be110b7bf70c8362d8,"Barker, A. K., Coogan, L. A., ... Gillis, K. M. (2010). INSIGHTS INTO THE BEHAVIOUR OF SULPHUR IN MID-OCEAN RIDGE AXIAL HYDROTHERMAL SYSTEMS FROM THE COMPOSITION OF THE SHEETED DYKE COMPLEX AT PITO DEEP. CHEMICAL GEOLOGY, 275, 105-115.",cec6f62cfb44b1be110b7bf70c8362d8,earthchem_export_jul14_26_14620,MORB
https://www.earthchem.org/petdb/citation/cf1cf43cba274ae7f413e864682b80f8,"Metrich, N., Allard, P., ... Massare, D. (2011). MAGMA AND VOLATILE SUPPLY TO POST-COLLAPSE VOLCANISM AND BLOCK RESURGENCE IN SIWI CALDERA (TANNA ISLAND, VANUATU ARC). JOURNAL OF PETROLOGY, 52(6), 1077-1105.",cf1cf43cba274ae7f413e864682b80f8,earthchem_export_jul15_26_5343,ARC
https://www.earthchem.org/petdb/citation/cf1f78fe923afe05f7597da2be7a3da8,"Heft, K., Gillis, K. M., ... Klein, E. M. (2008). ROLE OF UPWELLING HYDROTHERMAL FLUIDS IN THE DEVELOPMENT OF ALTERATION PATTERNS AT FAST SPREADING RIDGES: EVIDENCE FROM THE SHEETED DIKE COMPLEX AT PITO DEEP. GEOCHEM GEOPHYS GEOSYST, 9(5)",cf1f78fe923afe05f7597da2be7a3da8,earthchem_export_jul14_26_14620,MORB
https://www.earthchem.org/petdb/citation/cfa5301358b9fcbe7aa45b1ceea088c6,"Greene, A. R., Kuga, M., ... Ito, G. (2010). LOW-PRODUCTIVITY HAWAIIAN VOLCANISM BETWEEN KAUAI AND OAHU. GEOCHEM GEOPHYS GEOSYST, 11",cfa5301358b9fcbe7aa45b1ceea088c6,earthchem_export_jul15_26_51427,OIB
https://www.earthchem.org/petdb/citation/cfee398643cbc3dc5eefc89334cacdc1,"Van Wagoner, N. A., Leybourne, M. I. (1991). EVIDENCE FOR MAGMA MIXING AND A HETEROGENEOUS MANTLE ON THE WEST VALLEY SEGMENT OF THE JUAN DE FUCA RIDGE. J GEOPHYS RES, 96, 16295-16318.",cfee398643cbc3dc5eefc89334cacdc1,earthchem_export_jul14_26_14620,MORB
https://www.earthchem.org/petdb/citation/d03a857a23b5285736c4d55e0bb067c8,"Van Der Zander, I., Sinton, J. M., ... Mahoney, J. J. (2010). LATE SHIELD-STAGE SILICIC MAGMATISM AT WAI'ANAE VOLCANO: EVIDENCE FOR HYDROUS CRUSTAL MELTING IN HAWAIIAN VOLCANOES. JOURNAL OF PETROLOGY, 51(3), 671-701.",d03a857a23b5285736c4d55e0bb067c8,earthchem_export_jul15_26_51427,OIB
https://www.earthchem.org/petdb/citation/d045c59a90d7587d8d671b5f5aec4e7c,"Hoernes, S., Friedrichsen, H. (1983). OXYGEN ISOTOPIC COMPOSITION OF BASALTS FROM LEG 65, DEEP SEA DRILLING PROJECT. INIT REP DSDP, 65, 661-665.",d045c59a90d7587d8d671b5f5aec4e7c,earthchem_export_jul14_26_14620,MORB
https://www.earthchem.org/petdb/citation/d04d42cdf14579cd294e5079e0745411,"Huang, J., Zhang, X., ... Huang, F. (2018). ZINC ISOTOPIC SYSTEMATICS OF KAMCHATKA-ALEUTIAN ARC MAGMAS CONTROLLED BY MANTLE MELTING. GEOCHIMICA ET COSMOCHIMICA ACTA, 238, 85-101.",d04d42cdf14579cd294e5079e0745411,earthchem_export_jul15_26_5343,ARC
https://www.earthchem.org/petdb/citation/d04d42cdf14579cd294e5079e0745411,"Huang, J., Zhang, X., ... Huang, F. (2018). ZINC ISOTOPIC SYSTEMATICS OF KAMCHATKA-ALEUTIAN ARC MAGMAS CONTROLLED BY MANTLE MELTING. GEOCHIMICA ET COSMOCHIMICA ACTA, 238, 85-101.",d04d42cdf14579cd294e5079e0745411,earthchem_export_jul14_26_14620,MORB
https://www.earthchem.org/petdb/citation/d09bf41544a3365a46c9077ebb5e35c3,"Chauvel, C., Mcdonough, W. F., ... Duncan, R. A. (1997). CONTRASTING OLD AND YOUNG VOLCANISM IN RURUTU ISLAND, AUSTRAL CHAIN. CHEMICAL GEOLOGY, 139, 125-143.",d09bf41544a3365a46c9077ebb5e35c3,earthchem_export_jul15_26_51427,OIB
https://www.earthchem.org/petdb/citation/d1dc3a8270a6f9394f88847d7f0050cf,"Geshi, N., Umino, S., ... Hilde, T. W. C. (2007). DISCRETE PLUMBING SYSTEMS AND HETEROGENEOUS MAGMA SOURCES OF A 24 KM3 OFF-AXIS LAVA FIELD ON THE WESTERN FLANK OF EAST PACIFIC RISE, 14 DEG S. EARTH PLANET SCI LETT, 258, 61-72.",d1dc3a8270a6f9394f88847d7f0050cf,earthchem_export_jul14_26_14620,MORB
https://www.earthchem.org/petdb/citation/d1ee59e20ad01cedc15f5118a7626099,"Davis, A. S., Clague, D. A., ... Keaten, R. (2008). GEOCHEMISTRY OF BASALT FROM THE NORTH GORDA SEGMENT OF THE GORDA RIDGE:  EVOLUTION TOWARD ULTRASLOW SPREADING RIDGE LAVAS DUE TO DECREASING MAGMA SUPPLY. GEOCHEM GEOPHYS GEOSYST, 9(4)",d1ee59e20ad01cedc15f5118a7626099,earthchem_export_jul14_26_14620,MORB
https://www.earthchem.org/petdb/citation/d1f255a373a3cef72e03aa9d980c7eca,"Rogers, N. W. (1993). THE ISOTOPE AND TRACE ELEMENT GEOCHEMISTRY OF BASALTS FROM VOLCANIC ISLANDS OF THE SOUTHER RED SEA. GEOL SOC LONDON SPEC PUB, 76, 455-467.",d1f255a373a3cef72e03aa9d980c7eca,earthchem_export_jul14_26_14620,MORB
https://www.earthchem.org/petdb/citation/d1fe173d08e959397adf34b1d77e88d7,"Chase, R. L., Van Wagoner, N. A., ... Allan, J. F. (1995). MIXING OF MAGMAS FROM ENRICHED AND DEPLETED MANTLE SOURCES IN THE NORTHEAST PACIFIC: WEST VALLEY SEGMENT, JUAN DE FUCA RIDGE. CONTRIB MINERAL PETROL, 120, 337-357.",d1fe173d08e959397adf34b1d77e88d7,earthchem_export_jul14_26_14620,MORB
https://www.earthchem.org/petdb/citation/d210cf373cf002a04ec72ee395f66306,"Handley, H., Turner, S., ... Saal, A. E. (2011). INSIGHTS INTO THE GALÁPAGOS PLUME FROM URANIUM-SERIES ISOTOPES OF RECENTLY ERUPTED BASALTS. GEOCHEM GEOPHYS GEOSYST, 12(9)",d210cf373cf002a04ec72ee395f66306,earthchem_export_jul15_26_51427,OIB
https://www.earthchem.org/petdb/citation/d2350a54d774001d6078e326b4488878,"Robidoux, P., Rotolo, S., ... Hauri, E. H. (2017). GEOCHEMISTRY AND VOLATILE CONTENT OF MAGMAS FEEDING EXPLOSIVE ERUPTIONS AT TELICA VOLCANO (NICARAGUA). JOURNAL OF VOLCANOLOGY AND GEOTHERMAL RESEARCH, 341, 131-148.",d2350a54d774001d6078e326b4488878,earthchem_export_jul15_26_5343,ARC
https://www.earthchem.org/petdb/citation/d282ef263719ab842e05382dc235f69e,"Agranier, A., Blichert-toft, J., ... Albarede, F. (2005). THE SPECTRA OF ISOTOPIC HETEROGENEITIES ALONG THE MID-ATLANTIC RIDGE. EARTH PLANET SCI LETT, 238, 96-109.",d282ef263719ab842e05382dc235f69e,earthchem_export_jul14_26_14620,MORB
https://www.earthchem.org/petdb/citation/d2cd33e9c0236a8c2d8bd3fa91ad3acf,"Jackson, M. G., Price, A. A., ... Reinhard, A. (2017). GEOCHEMISTRY OF LAVAS FROM THE CAROLINE HOTSPOT, MICRONESIA: EVIDENCE FOR PRIMITIVE AND RECYCLED COMPONENTS IN THE MANTLE SOURCES OF LAVAS WITH MODERATELY ELEVATED  3 HE/ 4 HE. CHEMICAL GEOLOGY, 455, 400.",d2cd33e9c0236a8c2d8bd3fa91ad3acf,earthchem_export_jul15_26_51427,OIB
https://www.earthchem.org/petdb/citation/d309cd6396e744600c943fada20f686a,"Sinton, C. W., Harpp, K. S., ... Christie, D. M. (2014). A PRELIMINARY SURVEY OF THE NORTHEAST SEAMOUNTS, GALÁPAGOS PLATFORM. A NATURAL LABORATORY FOR THE EARTH SCIENCES, 362.",d309cd6396e744600c943fada20f686a,earthchem_export_jul14_26_14620,MORB
https://www.earthchem.org/petdb/citation/d37b3ca37106b2bfdeaa12647e3bb1c9,"Gannoun, A., Burton, K. W., ... Halliday, A. N. (2015). RESOLVING MANTLE AND MAGMATIC PROCESSES IN BASALTS FROM THE CAMEROON VOLCANIC LINE USING THE RE-OS ISOTOPE SYSTEM. LITHOS, 224-225, 12.",d37b3ca37106b2bfdeaa12647e3bb1c9,earthchem_export_jul15_26_51427,OIB
https://www.earthchem.org/petdb/citation/d38ee19a4815c4aeba48227913092a6e,"Amsellem, E., Moynier, F., ... Teng, F. (2018). THE STABLE STRONTIUM ISOTOPIC COMPOSITION OF OCEAN ISLAND BASALTS, MID-OCEAN RIDGE BASALTS, AND KOMATIITES. CHEMICAL GEOLOGY, null.",d38ee19a4815c4aeba48227913092a6e,earthchem_export_jul14_26_14620,MORB
https://www.earthchem.org/petdb/citation/d38ee19a4815c4aeba48227913092a6e,"Amsellem, E., Moynier, F., ... Teng, F. (2018). THE STABLE STRONTIUM ISOTOPIC COMPOSITION OF OCEAN ISLAND BASALTS, MID-OCEAN RIDGE BASALTS, AND KOMATIITES. CHEMICAL GEOLOGY, null.",d38ee19a4815c4aeba48227913092a6e,earthchem_export_jul15_26_51427,OIB
https://www.earthchem.org/petdb/citation/d403137434343677b98efc88cbd5493d,"Molendijk, S., Namur, O., ... Neave, D. (2024). MANTLE SOURCES UNDERLYING NYIRAGONGO VOLCANO. CHEMICAL GEOLOGY, 122607.",d403137434343677b98efc88cbd5493d,earthchem_export_jul14_26_14620,MORB
https://www.earthchem.org/petdb/citation/d490d7b4576290fa60eb31b5fc917ad1,"Duncan, R. A., Holmes, M. (1994). RADIOMETRIC DATING OF YOUNG MORB USING THE 40AR-39AR INCREMENTAL HEATING METHOD. GEOPHYS RES LETT, 21, 1927-1930.",d490d7b4576290fa60eb31b5fc917ad1,earthchem_export_jul14_26_14620,MORB
https://www.earthchem.org/petdb/citation/d494020ff8ec181ef98ed97ac3f25453,"Venugopal, S., Moune, S., ... Williams-jones, G. (2016). INVESTIGATING THE SUBSURFACE CONNECTION BENEATH CERRO NEGRO VOLCANO AND THE EL HOYO COMPLEX, NICARAGUA. JOURNAL OF VOLCANOLOGY AND GEOTHERMAL RESEARCH, 325, 211-224.",d494020ff8ec181ef98ed97ac3f25453,earthchem_export_jul15_26_5343,ARC
https://www.earthchem.org/petdb/citation/d58072be2820e8682c0a27c0518e805e,"Perfit, M. R., Jonasson, I. R., ... Ridley, W. I. (1998). GEOLOGIC, PETROLOGIC AND GEOCHEMICAL RELATIONSHIPS BETWEEN MAGMATISM AND MASSIVE SULFIDE MINERALIZATION ALONG THE EASTERN GALAPAGOS SPREADING CENTER. REVIEWS ECON GEOL, 100.",d58072be2820e8682c0a27c0518e805e,earthchem_export_jul14_26_14620,MORB
https://www.earthchem.org/petdb/citation/d5cfead94f5350c12c322b5b664544c1,"Chase, R. L., Barr, S. (1974). GEOLOGY OF THE NORTHERN END OF THE JUAN DE FUCA RIDGE AND SEA-FLOOR SPREADING. CAN J EARTH SCI, 11, 1384-1406.",d5cfead94f5350c12c322b5b664544c1,earthchem_export_jul14_26_14620,MORB
https://www.earthchem.org/petdb/citation/d64a340bcb633f536d56e51874281454,"Bezrukov, P. L., Chernysheva, V. I., ... Krylov, A. Y. (1966). PETROGRAPHY AND ABSOLUTE AGE OF BASALTS FROM THE INDIAN OCEAN. OKEANOLOGIYA, 6, 261-266.",d64a340bcb633f536d56e51874281454,earthchem_export_jul14_26_14620,MORB
https://www.earthchem.org/petdb/citation/d6ef5f7fa914c19931a55bb262ec879c,"Meurer, W., Sturm, M. E., ... Karson, J. A. (2001). BASALT COMPOSITIONS FROM THE MID-ATLANTIC RIDGE AT THE SMARK AREA (22 DEG 30' N TO 22 DEG 50' N) - IMPLICATIONS FOR PARENTAL LIQUID VARIABILITY AT ISOTOPICALLY HOMOGENEOUS SPREADING CENTERS. EARTH PLANET SCI LETT, 186, 451-469.",d6ef5f7fa914c19931a55bb262ec879c,earthchem_export_jul14_26_14620,MORB
https://www.earthchem.org/petdb/citation/d707329bece455a462b58ce00d1194c9,"Aumento, F., Loncarevic, B. D. (1969). THE MID-ATLANTIC NEAR 45 DEG N. III.BALD MOUNTAIN. CAN J EARTH SCI, 6, 11-23.",d707329bece455a462b58ce00d1194c9,earthchem_export_jul14_26_14620,MORB
https://www.earthchem.org/petdb/citation/d74cb35426f3d808325876f45b69dbf1,"Deino, A., Scott, G., ... Haile-selassie, Y. (2010). 40AR\/39AR DATING, PALEOMAGNETISM, AND TEPHROCHEMISTRY OF PLIOCENE STRATA OF THE HOMINID-BEARING WORANSO-MILLE AREA, WEST-CENTRAL AFAR RIFT, ETHIOPIA. JOURNAL OF HUMAN EVOLUTION, 58(2), 111-126.",d74cb35426f3d808325876f45b69dbf1,earthchem_export_jul15_26_51025,CIB
https://www.earthchem.org/petdb/citation/d77e68596c15c53c2a33ad143739902d,"Hanan, B. B., Konter, J. G., ... Dauphas, N. (2016). UNUSUAL DELTA56FE VALUES IN SAMOAN REJUVENATED LAVAS GENERATED IN THE MANTLE. EARTH PLANET SCI LETT, 450, 232.",d77e68596c15c53c2a33ad143739902d,earthchem_export_jul14_26_14620,MORB
https://www.earthchem.org/petdb/citation/d77e68596c15c53c2a33ad143739902d,"Hanan, B. B., Konter, J. G., ... Dauphas, N. (2016). UNUSUAL DELTA56FE VALUES IN SAMOAN REJUVENATED LAVAS GENERATED IN THE MANTLE. EARTH PLANET SCI LETT, 450, 232.",d77e68596c15c53c2a33ad143739902d,earthchem_export_jul15_26_51427,OIB
https://www.earthchem.org/petdb/citation/d80126524c1e9641333502c664fc6ca1,"Stubseid, H., Bjerga, A., ... Pedersen, R. B. (2024). EXTREME MANTLE HETEROGENEITY REVEALED BY GEOCHEMICAL INVESTIGATION OF IN SITU LAVAS AT THE CENTRAL MOHNS RIDGE, ARCTIC MID‐OCEAN RIDGES. GEOCHEMISTRY, GEOPHYSICS, GEOSYSTEMS, 25(11), null.",d80126524c1e9641333502c664fc6ca1,earthchem_export_jul14_26_14620,MORB
https://www.earthchem.org/petdb/citation/d80b7040b773199015de6d3b4293c8ff,"Peters, B. J., Nauret, F., ... Castillo, P. R. (2025). Sr-Nd-Pb isotopic compositions of ocean island basalts from the Crozet and Juan Fernandez archipelagoes. null, null.",d80b7040b773199015de6d3b4293c8ff,earthchem_export_jul15_26_51427,OIB
https://www.earthchem.org/petdb/citation/d81f9c1be2e08964bf9f24b15f0e4900,"Hekinian, R., Subbarao, K. V., ... Reddy, V. V. (1979). RARE EARTH GEOCHEMISTRY OF BASALTS FROM THE FAMOUS AREA MID-ATLANTIC RIFT VALLEY: A PRELIMINARY STUDY. J GEOL SOC INDIA, 20, 565-569.",d81f9c1be2e08964bf9f24b15f0e4900,earthchem_export_jul14_26_14620,MORB
https://www.earthchem.org/petdb/citation/d840cc5d906c3e9c84374c8919d2074e,"Brueckner, H. K., Seyler, M., ... Zindler, A. (1988). ZABARGAD AND THE ISOTOPIC EVOLUTION OF THE SUB-RED SEA MANTLE AND CRUST. TECTONOPHYSICS, 150, 163-176.",d840cc5d906c3e9c84374c8919d2074e,earthchem_export_jul14_26_14620,MORB
https://www.earthchem.org/petdb/citation/d84210a75448034bcc4947005695c306,"Morton, W., Rex, D., ... Mohr, P. (1979). RIFTWARD YOUNGING OF VOLCANIC UNITS IN THE ADDIS ABABA REGION, ETHIOPIAN RIFT VALLEY. NATURE, 280(5720), 284-288.",d84210a75448034bcc4947005695c306,earthchem_export_jul15_26_51025,CIB
https://www.earthchem.org/petdb/citation/d88518acbcc3d08d1f18da62f9bb26ec,"Timm, C., Graham, I. J., ... Woodhead, J. D. (2011). GEOCHEMICAL EVOLUTION OF MONOWAI VOLCANIC CENTER: NEW INSIGHTS INTO THE NORTHERN KERMADEC ARC SUBDUCTION SYSTEM, SW PACIFIC. GEOCHEM GEOPHYS GEOSYST, 12(8)",d88518acbcc3d08d1f18da62f9bb26ec,earthchem_export_jul15_26_5343,ARC
https://www.earthchem.org/petdb/citation/d8c24ca8f23c562a5600876ca2a550ce,"Blegen, N., Jicha, B., ... Mcbrearty, S. (2018). A NEW TEPHROCHRONOLOGY FOR EARLY DIVERSE STONE TOOL TECHNOLOGIES AND LONG-DISTANCE RAW MATERIAL TRANSPORT IN THE MIDDLE TO LATE PLEISTOCENE KAPTHURIN FORMATION, EAST AFRICA. JOURNAL OF HUMAN EVOLUTION, 121, 75-103.",d8c24ca8f23c562a5600876ca2a550ce,earthchem_export_jul15_26_51025,CIB
https://www.earthchem.org/petdb/citation/d9b1655c134b831076d6c45620a78c33,"Yang, S., Fang, N. (2015). GEOCHEMICAL VARIATION OF VOLCANIC ROCKS FROM THE SOUTH CHINA SEA AND NEIGHBORING LAND: IMPLICATION FOR MAGMATIC PROCESS AND MANTLE STRUCTURE. ACTA OCEANOLOGICA SINICA, 34(12), 124.",d9b1655c134b831076d6c45620a78c33,earthchem_export_jul15_26_51025,CIB
https://www.earthchem.org/petdb/citation/d9d4f495e875a2e075a1a4a6e1b9770f,"Hanson, G. N., Taylor, S. R., ... Bender, J. F. (1977). PETROGENESIS OF BASALTS FROM THE FAMOUS AREA; MID-ATLANTIC RIDGE. EARTH PLANET SCI LETT, 36, 133-156.",d9d4f495e875a2e075a1a4a6e1b9770f,earthchem_export_jul14_26_14620,MORB
https://www.earthchem.org/petdb/citation/da11e8cd1811acb79ccf0fd62cd58f86,"Blichert-toft, J., Andres, M., ... Schilling, J. (2004). NATURE OF THE DEPLETED UPPER MANTLE BENEATH THE ATLANTIC:  EVDIENCE FROM Hf ISOTOPES IN NORMAL MID-OCEAN RIDGE BASALTS FROM 79 DEG N TO 55 DEG S. EARTH PLANET SCI LETT, 225, 89-103.",da11e8cd1811acb79ccf0fd62cd58f86,earthchem_export_jul14_26_14620,MORB
https://www.earthchem.org/petdb/citation/da974f5eba1948690c83e9c3b43ffd87,"Mohr, P., Mitchell, J., ... Raynolds, R. (1980). QUATERNARY VOLCANISM AND FAULTING AT O’A CALDERA, CENTRAL ETHIOPIAN RIFT. BULLETIN VOLCANOLOGIQUE, 43(1), 173-189.",da974f5eba1948690c83e9c3b43ffd87,earthchem_export_jul15_26_51025,CIB
https://www.earthchem.org/petdb/citation/dabd8d2ce74e782c65a973ef76fd540b,"Andres, M., Blichert-toft, J., ... Schilling, J. (2002). HAFNIUM ISOTOPES IN BASALTS FROM THE SOUTHERN MID-ATLANTIC RIDGE FROM 40 DEG S TO 55 DEG S: DISCOVERY AND SHONA PLUME-RIDGE INTERACTIONS AND THE ROLE OF RECYCLED SEDIMENTS. GEOCHEM GEOPHYS GEOSYST, 3(10)",dabd8d2ce74e782c65a973ef76fd540b,earthchem_export_jul14_26_14620,MORB
https://www.earthchem.org/petdb/citation/db116b39f7a3ac5366079b1d9fe249a5,"Hoernle, K., Van Den Bogaard, P., ... Mocek, B. (1999). EVIDENCE FOR MIOCENE SUBDUCTION BENEATH THE ALBORAN SEA: AR40_AR39 DATING AND GEOCHEMISTRY OF VOLCANIC ROCKS FROM HOLES 977A AND 978A. PROC ODP, SCI RESULTS, 161, 357-373.",db116b39f7a3ac5366079b1d9fe249a5,earthchem_export_jul14_26_14620,MORB
https://www.earthchem.org/petdb/citation/db9ad56c71619aeed9723314d1456037,"Israel, C., Boyet, M., ... Bouvier, A. (2019). FORMATION OF THE CE-ND MANTLE ARRAY: CRUSTAL EXTRACTION VS. RECYCLING BY SUBDUCTION. EARTH AND PLANETARY SCIENCE LETTERS, 115941.",db9ad56c71619aeed9723314d1456037,earthchem_export_jul15_26_51025,CIB
https://www.earthchem.org/petdb/citation/db9ad56c71619aeed9723314d1456037,"Israel, C., Boyet, M., ... Bouvier, A. (2019). FORMATION OF THE CE-ND MANTLE ARRAY: CRUSTAL EXTRACTION VS. RECYCLING BY SUBDUCTION. EARTH AND PLANETARY SCIENCE LETTERS, 115941.",db9ad56c71619aeed9723314d1456037,earthchem_export_jul15_26_51427,OIB
https://www.earthchem.org/petdb/citation/dbc4d84bfcfe2284ba11beffb853a8c4,"Brown, F. (1969). OBSERVATIONS ON THE STRATIGRAPHY AND RADIOMETRIC AGE OF THE 'OMO BEDS', LOWER OMO BASIN, SOUTHERN ETHIOPIA. QUATERNARIA, 11, 7-14.",dbc4d84bfcfe2284ba11beffb853a8c4,earthchem_export_jul15_26_51025,CIB
https://www.earthchem.org/petdb/citation/dbd22ba3bd0df8f385bdac3e9f8be207,"Romick, J. D., Perfit, M. R., ... Shuster, R. (1990). MAGMATISM IN THE EASTERN ALEUTIAN ARC: TEMPORAL CHARACTERISTIC OF IGNEOUS ACTIVITY ON AKUTAN ISLAND. CONTRIB MINERAL PETROL, 104(6), 721.",dbd22ba3bd0df8f385bdac3e9f8be207,earthchem_export_jul15_26_5343,ARC
https://www.earthchem.org/petdb/citation/dbe272bab69f8e13f14b405e038deb64,"Javoy, M., Agrinier, P., ... Hekinian, R. (1995). O AND H STABLE ISOTOPE COMPOSITIONS OF OCEANIC CRUST AND UPPER MANTLE ROCKS EXPOSED IN THE HESS DEEP NEAR THE GALAPAGOS TRIPLE JUNCTION. EARTH PLANET SCI LETT, 136, 183-196.",dbe272bab69f8e13f14b405e038deb64,earthchem_export_jul14_26_14620,MORB
